{
  "contractVersion": 2,
  "ruleFingerprint": "759406550bc144d59973d0e26573d532614551bbe7a1b7bbacb2307a956bd274",
  "launchInitiallyHeld": true,
  "manifest": {
    "rulesVersion": 2,
    "courseId": "reins-v2",
    "seed": 104,
    "surface": "HardPack",
    "roundIndex": 0,
    "horse": {
      "nervePermille": 500,
      "firePermille": 500,
      "biddabilityPermille": 500,
      "heartPermille": 500
    }
  },
  "frames": [
    {
      "tick": 1,
      "leftPermille": 0,
      "rightPermille": 0,
      "cadenceTap": false,
      "launchHeld": true,
      "wrap": false,
      "drive": "None"
    },
    {
      "tick": 2,
      "leftPermille": 0,
      "rightPermille": 0,
      "cadenceTap": false,
      "launchHeld": true,
      "wrap": false,
      "drive": "None"
    },
    {
      "tick": 3,
      "leftPermille": 0,
      "rightPermille": 0,
      "cadenceTap": false,
      "launchHeld": true,
      "wrap": false,
      "drive": "None"
    }
  ]
}
